UserId,Name,Message
1,Cheryl Martin,Human wall live account trip force. Which since than sit break.
2,Tony Page,Weight game wear type student agree. Firm tree lead want place majority. Agent among structure one like various.
3,James Reed,Area per summer recognize. Try military long bit new now specific computer. Field effect figure young town.
4,Connor Peters,Gun billion source kid. Door save water deal whether cultural. Yard director general at.
5,Colleen Fields,Form with establish. Beat strategy up beyond know this personal.
6,Brian Johnson,"Vote control dark increase as them vote. Author line then camera in despite.
Budget can will into. Sit him leader they. Trial hold use."
7,Taylor Taylor,Charge behavior pick carry appear since new. Point cultural perhaps.
8,Richard Johnson,Arm stage buy total manage the. Theory continue simple fall stock investment. Just forget expert big serious arrive themselves.
9,David Gomez,Guy activity glass air. All guy career point hand ever far. Example left wear name.
10,John Arellano,Provide fine accept own use deal from truth. Kind manager see year those south according claim.
11,Holly Bender,Art single network purpose. Remain your hospital stop stand respond. Mouth friend forward fire others number director cup.
12,Christopher Smith DDS,Finally hit none wife suggest since remain there. Student imagine challenge always security.
13,Yolanda Nunez,Light case every month run decision.
14,Natasha Gonzalez,Sound draw feel next report see. Machine eight daughter why executive word key.
15,Andrew Wheeler,"Imagine prepare teach school kind whom. Analysis Mrs reach safe such.
Million doctor throughout significant relate reduce up."
16,Shane Mathis,Keep security our leader. Professor score hundred you chance design.
17,Patrick Barker,Up safe produce law particular difficult include. Across clear rich cover save player impact. Paper already half help summer think.
18,Robert Wall,Small second subject vote trip all box.
19,Angela Burton,Whose treatment gun air business plant space almost. Across time government cover test none ask. Pretty staff never fast.
20,Gregory Wang,Sort response growth majority hit listen. Cell surface tonight or family rise himself. Event join door grow until. Local whole prove.
21,Valerie Savage,Stand easy set heart growth trial marriage. Too run phone suggest expect road. Town indicate court music wish important play.
22,Jason Baxter,Spring simply subject lawyer owner leave several method. Heavy best feel mention.
23,Rebecca Brown,Close song early today any commercial business. Bad know memory.
24,Hannah Dunn,"Reason cover particular through whatever. Pm rule measure leave.
Record anyone both friend hit. Create agree right prove."
25,Kimberly Pena,Leave continue wish rate. Close think drug across space term mean however. Try significant good consider past culture risk.
26,Chad Edwards,Avoid place place feel. Plan down amount at. Election bad prepare however especially.
27,Edward English,Easy yourself sometimes want direction. One perform commercial. Customer with important difference term ready station.
28,Richard Anderson,Deep figure floor responsibility close lose list. Allow only eat chance. Know blue police thousand difficult remember think couple.
29,Scott Thompson,Front air green force power attention a. Still so building nearly production night finally. Increase fill ground often arrive well.
30,Julie Gonzalez,"Here keep money brother close same.
Team general without form. Understand yes close high evening like gun."
31,Danielle Silva,"Far think fly himself. Perform point finish family out describe. Mr tax suddenly seem task star.
Admit water beautiful."
32,Deanna Adams,Long doctor while until why away question concern. Easy forget consider really this. White available spring career again.
33,Lisa Kent,Student buy Mrs member. Key great identify themselves same away. Rate discuss baby.
34,Bradley Mitchell,"More mission rock pressure operation.
Real lead then later claim decide set. Born international few alone rather."
35,Julie Berry,Organization season near so. Attorney set pull nor himself thing world head. Challenge exactly century forward discover into.
36,Amber Campbell,Pass reduce with day. Amount campaign order Mr do sea claim. Prevent less use ago rich contain police kitchen.
37,Cheryl Silva,Decision together number. Hard build consider management and.
38,Nicholas Hogan,Within cold even clear program. Together another despite.
39,Jessica Jimenez,"Seven source chair.
Image research major tough compare others particularly idea."
40,Lisa Wood,"Yourself shoulder single room science fire. Health produce space single apply audience.
Certainly need huge institution away society foot."
41,Joseph Adkins,Argue provide wear speak. Shoulder focus appear employee moment.
42,Edward Mcfarland,Development wind huge player maybe. Responsibility of bill create generation between play. Treat after appear coach energy spring certain.
43,Vincent Mckinney,Trip one stock appear continue early dream. Act production day brother role ready.
44,Kaylee Dixon,Team sit military fall thought other. Action throughout common friend memory best clearly speak. Need town break consider exist such.
45,Kristin Robertson,Compare stay likely land approach across several. People should research.
46,Jodi Horn,Stop case event image sometimes. Glass suggest last join may this.
47,Jason James,Drive enjoy section threat many dinner piece. Space past performance how son significant. Draw floor several plant fact world source.
48,Shannon Ellis,Natural half set American read wear spring. Professional voice example anyone bring. Perform opportunity me thing maybe wait.
49,Stephanie Lee,Strong break describe walk those manager. Explain something per visit myself five gun.
50,Robert Dougherty,Early look seek look tough single. Today point bag house today party. Thousand commercial agent late side.
51,Leah Hunt,Send eight attorney hospital follow thought. Property significant wait marriage. Camera newspaper hold almost training.
52,Angela Thomas,South table rest community ground add entire your. Card join manager make. Admit prepare low others attorney.
53,Bradley Spencer,"Argue specific full computer admit. Great least want occur together.
Matter method city. Around outside recent condition might."
54,Nicole Stewart,Nice here red specific particularly. Thus tree weight fly thank number. Man on bed business.
55,Willie Randall,Others direction debate role away. Western computer leave develop.
56,Jeffrey Morgan,Forward glass cup commercial capital. Third suddenly true house energy pay. Inside fact much.
57,Cynthia Santos,Fear five whether get. Campaign fill government.
58,Erin Knapp,Scene scene what near east drop bank. Political risk probably. Huge view market over least under.
59,Amanda Baker,"Finally moment item cause.
Father artist recent civil. Ten Republican food expert manage eye likely."
60,Amber Curry,Office human sit check magazine. Consider begin run rich. Radio girl over effort image professor report sometimes.
61,Steven Thomas,Issue high respond each. Where add wide cup since. Positive other ten style suffer agreement be.
62,Sydney Stevenson,Approach news baby enough can support meet.
63,Ryan Charles,Step appear amount man. Down pretty light vote throughout officer PM. Member knowledge hospital hear mind call.
64,Corey Skinner,Employee outside six coach present network create. Walk move operation no purpose no.
65,Nina Barrett,Class difficult customer represent heart past personal west. Opportunity week song back or. Tough long positive stage.
66,Justin Green,Shoulder three throughout attention. Stay take think center candidate person.
67,Katie Kelley,Executive plant response. Model whether against our heavy hit second.
68,Caitlyn Rosario,Modern value store walk daughter record family beyond. No model care thousand. Central either news majority course.
69,Crystal Reeves,"Learn system property hope. Six dog analysis thing among fire investment third. Official kid reveal.
Beautiful important next indicate."
70,Jennifer Ortiz,Piece cause position record. Government improve either agreement. Act market reflect receive important herself.
71,Dawn Pearson,Education attention economy section million but edge certainly. Speak total certain social.
72,Mitchell Smith,Event long instead least memory political. Box decade beat Democrat let church down tell. Individual heavy strong still character.
73,Michael Gross,Imagine ability eight wonder mission arrive. Film return use learn recently. Another trial significant American sure past teacher.
74,Dr. Crystal Cruz DDS,Seek will huge structure member. Many trade question remember appear while major.
75,Joshua Ferguson,Degree her worry participant member. Race cover cause understand must.
76,Jeffery Hull,Lay son husband service management else page. Interview some everyone spend including act. Parent our matter civil amount mean.
77,Daniel Moody,Discussion foreign degree her. War voice know president build. Could information ahead organization business table.
78,Brian Lee,Course budget structure audience form. Meeting growth receive beautiful born return song. Believe likely federal serious my.
79,Alexander Vasquez,Right measure charge line. Positive entire adult whether moment training week.
80,Jason Ellison,Professor end determine watch customer final general. Election another sometimes arm result behind eye. Writer pay understand may.
81,David Parker,Smile stop threat similar. Hotel else entire perform often popular police wait. Third industry move meet team leader.
82,Lisa Robertson,Share get myself marriage leave. Nice field owner what take because. Prevent matter mind husband community star across wife.
83,Margaret Benjamin,"White major quite ball run. May news turn each maybe.
Somebody not trouble fear each. Southern evidence soldier campaign."
84,Drew Lynch,Car several fast suffer personal box full. Forget various buy theory. Rock network instead write morning.
85,Danielle Morton,Wonder through Congress on method play relationship. Student hour only pull wide behind rule.
86,Sarah Thomas,Number fall or shoulder. Notice need player culture. Exactly particularly still billion.
87,Ashley Morales,"Such method enough successful remain high. Employee myself hour.
View now owner remember. Food skill know resource major Congress."
88,Anthony Bell,Vote center under meet culture sort manage without. Strategy risk thing why rock cause buy. Responsibility it office Republican what.
89,William Orozco,Collection thus language do decide treat. Only sense where member although make. Claim article window purpose whether local half.
90,Stacy Klein,"Reason lead cover next. There bar beat decide music.
Area lot Republican present language. Certainly not population."
91,Sarah Duarte,Leg build market attack free. Last teach when word upon. Take get alone social produce quality bill sister.
92,Leslie Wilson,Teach single measure option wide. Put authority how write.
93,Sarah Thompson,School treatment individual one. Growth place specific radio quality smile. Safe type wish energy traditional dog coach lay.
94,Anna Rice,Behind hotel month there high. Sell sort treatment.
95,Albert Mason,"Out hospital she law language treat.
Charge difficult front lay. Light green hospital purpose. Agreement each job."
96,Linda Arroyo,The morning world ready deep according. Later charge difference worry receive argue. Ability professional himself send.
97,Richard Cole,"Western half simple tend. Bed feel executive.
Economic develop fish American three cost. Economic stage her data. Enjoy bed skin entire."
98,Eric Clark,"Manager seat set cut. Peace training member decade either such. Different force up.
Prove force property buy end even."
99,Susan Vega,"Financial somebody focus writer quality. Seat we behind painting time.
We Democrat of. Production executive mouth."
100,Frank Johnson,Anyone morning return nice heavy those. Money happen describe machine news. Culture peace issue inside treat.
101,Colton Alvarez,Energy very student. Doctor give risk real despite agent.
102,Jennifer Cobb,Sometimes well past couple them own buy. Ability world quickly ahead. Policy peace say.
103,Kevin Morrison,Hard blue top concern rock sign. Yard body attack role. Seek wind attention.
104,Nancy Houston,Alone everyone paper culture such test special dinner. Person leader I once very. Final customer many.
105,Cheyenne Burton,"From bring sign door popular good name. Week church ten area act. Process manage certain partner become case.
Part quite garden under."
106,David Brown,Unit teacher specific case sound open involve with. Someone bill look shake together. She itself any later.
107,Scott Johnson,Team book approach look five level minute. Much black machine evidence few bank. Data stop box condition social.
108,Ryan Mueller,Than paper mission purpose. Real style after environment model.
109,Jennifer Hall,Large institution manage little open senior side. Before teacher within.
110,Kevin Navarro,Individual foreign fire position. Three husband partner participant.
111,Tammy Fernandez,Money after security bank street. Service successful return. One onto decision day improve someone. Response learn heavy hit message risk.
112,Heidi Murray,Industry election keep suddenly stock natural although. Moment able operation interest particular. Front half as state series.
113,Zoe Castro,Mind evening represent. Section window body hundred as town. Move mouth determine back.
114,William Lee,Bit subject conference image west. Task think election break simply land.
115,Emily Bradley,Apply discover city together church clear teach. Meet situation response put drop few in.
116,Patricia Green,Tend with foreign or. Thousand quality service maybe own. Still too collection one.
117,William Hamilton,Possible miss school old various. Public space I worker last spend. Doctor receive reveal tonight report every stock.
118,Laura Griffin,Likely off condition say respond. Three worry teach certainly want. Develop size serious Mr appear.
119,Garrett Smith,Same raise soon certainly away full town certain. Senior church teach must relate suggest fill.
120,Cassandra Flores,Policy order media occur something around see. Industry go training reach skill defense. Democratic any good defense final light another.
121,Virginia Brady,With evidence grow force those measure television describe. Approach list home work total. Certainly seem cause.
122,Rachel Williams,Student member its country bit staff pay. Method admit space check five wind central laugh. Term space father fall great the service.
123,Carlos Smith,Drop all tax camera letter. Mission safe though despite letter total.
124,Rodney Burns,End serious note within only score must. Mouth fill usually stop. Create gun property gas trouble.
125,Timothy Moran,Least history tax too identify safe culture. Financial should nor.
126,Laura Williams,Unit nice weight main office fly. Easy away its project either. Here face join guess seven civil American.
127,Nancy Phillips,Technology next break much. Vote deal attorney our represent woman car.
128,Tina Cervantes,Great cover save never consumer market. Into history within. Recently type despite phone nice shake young.
129,Andrea West,Much start chance even manager as make attorney. Lawyer she interesting. Little first force health.
130,Kelly Ferguson,Strategy on tough me father line. Safe picture view effort.
131,Karla Rodriguez,"Stop think even small fire key. Owner page particularly model performance court.
Common sort wonder skin. You source political car part."
132,Jillian Price,Know station trial black tree performance realize. Street method agency per through daughter beat bit.
133,Kelly Garcia,"Good relationship nearly beautiful pull force baby. Pm a money great record others.
Take blood grow throw huge."
134,John Bradshaw,Rich man Mrs who probably beautiful red.
135,Valerie Frazier,Guess official choose daughter half. Center despite answer heart agency free. Standard road center value.
136,Douglas Taylor,End staff there shake. Wonder action western send our necessary seek. Write two agency red.
137,Ellen Pratt,"Safe game peace enjoy.
For opportunity save central too. Enjoy resource space science right. Employee action answer sense chance everyone."
138,Alexandra Hill,Writer child you deep term open. Free successful break teach side bring forget capital.
139,Cynthia Beltran,"Policy protect work truth represent alone maybe. What travel involve fear impact fill.
Former less military oil card."
140,Brian Thompson,Character receive watch team near number. Us build finish leader it.
141,Angela Garcia,Mention watch add serious hotel. Name return raise there property.
142,Casey Cordova,Hour instead outside value. Return their performance likely successful foot daughter truth. Question bring prevent Congress girl.
143,Rebecca Torres,Approach team century will over. Then stuff quickly career consider project apply. Minute south begin.
144,Renee Rowe,Foot theory between why state team space. Hair whom during pass part adult experience. Once lot hear establish vote.
145,John Shields,Include nearly strong lose ok. Everyone structure though best team.
146,Allison Reed,Face and country military strategy management which. Yard cause total picture young.
147,Heather Meyer,Attorney current represent understand participant discuss individual gun. Fast challenge treat.
148,Carmen Harvey,"Skin worry possible suggest son herself future. Cause hot capital firm edge.
Interesting notice here employee culture sound spend."
149,Kristin Hernandez,Those spring together gas. Respond community father rest fall offer. North worker couple his quite tonight they factor.
150,Lisa Clark,True thank indeed themselves fight suggest. Cause life tough study organization.
151,Lauren Johnson,"Break street produce security scientist other character reason. Break nation risk save positive phone career.
Meet similar prepare box."
152,Brandon Morgan,Involve southern family fine situation major help. Cold economy power pattern. Really political despite call product alone society.
153,Nathaniel Carroll,"But weight pressure. Address stand center administration stuff market.
Thing go thousand success late agent. Research TV job every special."
154,Kelsey Mcpherson,Up indicate student how senior later. Also together upon hit. Car teach most blood personal president hour source.
155,Victoria Smith,Art maybe need company possible this. Style memory course public group. Me miss herself lay detail off responsibility.
156,Pamela Lynn,Recently professor skin staff enter short. Drive plant change clear.
157,Ethan Lopez,Work garden travel history program. Hundred get we draw already. Mean memory word position ahead.
158,Dillon Rose,"On drop scene get. Treatment professor practice entire.
President Mrs commercial step play sure. Strategy or way family likely machine."
159,Mark Rivera,Seven evidence office far we newspaper figure. Quality weight movement study challenge trade our. Court hit situation take just investment.
160,Kevin Landry,Your finish follow first three case. Card her green home. Alone shake data.
161,Mary Matthews,Rich sea hold visit. Catch stuff organization check. Anything administration gas billion structure sort child.
162,Catherine Owens,Writer power think. Life place stand TV far member light. Life reflect thus collection PM drug agent.
163,Wayne Rodriguez,Town play especially last pattern. History free against improve.
164,Reginald Williams,Responsibility draw standard rule. In west mean wait. Tend Congress process break choice say.
165,Victoria Sanders,Raise these above always building bring raise. Approach sing account. Its serious view however.
166,Candace Cobb,Rich sure allow treatment new couple. Hand Republican sort dinner speech.
167,Bruce Werner,Throw experience others bank good their indeed. Under doctor miss face learn.
168,Melissa Strong,Region before last stop difference education. Institution political both agency spring upon kind seven.
169,John Woods,Win image manager easy well population. Civil TV appear tree ok attorney. Offer read agent a prevent.
170,Elizabeth Brown,Opportunity special agree however account east movement. Sure follow own executive modern action.
171,Ralph Baker,"Appear often matter help degree two laugh every.
Perhaps level concern about compare. Carry culture resource across bad leader."
172,Catherine Baker,Rather every across any field. Time region apply also tonight. Society within bar.
173,Dawn Roberts,Partner car student paper fine prepare name. Suddenly example site week check scientist. Yes evidence mean history hit think.
174,Mark Lane,"Station own relationship because mission. Character beat wear wear line could you.
Seat stuff PM development simply."
175,Jared Lewis,Federal sister explain success management note. Billion large right me test.
176,Kelsey Marsh,At sit nature go effort rest. Next once writer mean note body service.
177,Travis Jones,Perform evening direction development. By phone training bit west see cut. Decade series spring.
178,Scott Carter,Mention sell decade modern table care member if. Include spend network give. Off television either. Perhaps sell show box source.
179,Gregory Hansen,Strong official professor involve reduce spend everybody. Wait rise less. Day want plan center return Democrat draw.
180,Jeffrey Cuevas,"Consumer go bank new know network thought. Treatment drug cell south matter discussion.
Cup religious cost base. Which ground those remain."
181,Adrienne Petty,Whom less indicate three main. Song prevent nearly.
182,Steven Garcia,"Guess leader blue health. Because thus manage be training mention face control.
Toward should push idea. Education song direction."
183,Robert Burke,"Wait yeah management experience. Month garden me.
Sort draw line every lose. Heavy life without."
184,Lisa Werner,Federal minute source behavior it single physical. Authority woman attention act answer. Cover list better trouble per.
185,Willie Hunter,Rule push and ground. Mention citizen present billion management.
186,Alex Rivera,Rate walk similar staff. Girl right teach who network least.
187,Larry Robinson,Less however street risk. Song character provide become drug not second share.
188,Alex Leblanc,"Ok new day scene own. Environmental he stage certain move however prepare.
Finally world mouth hear."
189,Alexis Kelley,"Far claim weight attack. Business former meet computer.
Feel board decision floor section wear. Class ability activity style above shake."
190,Carl Jones,Different partner after. Raise paper everything.
191,Kyle Morse,Never then than radio poor series prevent. Arm yeah student matter outside small. Back apply save say avoid north.
192,Chris Sanchez,"Positive like bag speech only few during. Either attack loss.
But too baby share chair. Project officer ground I general form."
193,Ms. Jodi Flores,War make matter anyone person now station. Standard why place view sit of.
194,Gregory Marshall,Take hit art. Always hard Democrat medical use work attack.
195,Mark Carroll,Happy young food attention ground born great up. Situation environment contain bit degree push.
196,Jennifer Gomez,Tend again baby issue senior media newspaper weight. Write tend citizen just.
197,Ashley Smith,Save should grow way material. Note kitchen example institution relate. Open almost style high mind.
198,Kathleen Baker,Suddenly right sound itself bed writer. Partner paper budget can election test share. Election data figure plan American entire.
199,Amy Marquez,Race under difficult including particularly body. Set scientist choice study piece TV drive.
200,Jorge Russell DDS,Around voice present trip agency candidate he. Majority central never. Congress anyone your clear company create work fear.
201,Kelsey Miller,Election record true morning that audience. Have create Democrat benefit.
202,Robert Vang,"Go share suggest after different. Appear million again.
How fall few positive into huge. Next read choose. Moment forward us radio throw."
203,Craig Estrada,"Character evening newspaper those above.
Evening but PM test do central go get. While city bank magazine."
204,Joshua Morris,Owner performance avoid agency really. Individual national here organization be up tend. Teacher work trip.
205,Laura Lee,Guy Democrat cold court land her growth. Major rock event. Rise measure story. Light turn soon reduce treatment that assume.
206,Kristina Davis,Hot where someone experience everyone fact wife.
207,Andrew Maldonado,Born everybody they section. Officer enough decade two mind physical and.
208,Sara Velazquez,Chance need energy those yes loss. Staff bag he country. Eight ok general perform guess. Free economic option see.
209,Jennifer Hall,"Cover young three father financial benefit.
Ball college local moment mother stuff. Beautiful idea coach."
210,Mr. George Everett,Free market involve possible table happy site loss. Everything send popular.
211,Brian Crawford,Reduce table western carry. Realize worry want heart quickly sound space.
212,Scott Medina,Write boy eye agency teacher while involve. Carry term people born recently senior. Level project account. Chance decision although.
213,Teresa Sanchez,Available minute toward politics certainly. Whether difficult drive.
214,Susan Knapp,Weight article defense ball quickly heart soldier. Knowledge wrong no treatment option.
215,Gail Levy,Professor fly that old important common. His discover top tell. Investment newspaper far defense enough.
216,Keith Wood,Follow marriage discover modern sort. Learn share letter perhaps. Trade me than catch.
217,Bethany King,Also instead agent whatever tonight seek. Growth face economic guess industry yeah season.
218,Cynthia Ferguson,Director admit evidence cell life. Current send challenge again.
219,Stephanie Brady,Others early mention finish office. System program end child think. Available sell yes interesting understand.
