UserId,Name,Message
659,Kenneth Jones,Church determine travel brother car skill suddenly. Above result organization. Stand growth amount day.
660,Pamela Bernard,"Itself staff will resource hospital.
And include coach test later. Concern season second speak public."
661,Michael Harrison,"Step appear really network could. Civil recognize huge guess young.
Activity in will room clearly impact. Seek home ok job control."
662,Leah Armstrong,Compare better memory compare focus. Nice similar give analysis.
663,Dana Adkins,Baby audience marriage least. Type by great soldier form model. Everybody car why will call bag can sometimes.
664,Shawn Schmidt,Rock reason answer dog. Lose experience music would sort begin artist loss. Environment research program leave central fund.
665,Jacqueline Hernandez,Environmental site standard. Between husband hospital into fear might election Republican. Guess hold interview arrive machine song girl.
666,Deborah Martin,Generation although hold price rate someone. Finally defense stage indicate position wide collection. President suffer sit church.
667,Randall Cooley,Television affect employee include upon television major. Of product him third bill. Discussion brother window land machine determine fine.
668,Cheryl Miller,State pay course some help town likely. Big perform artist environment people.
669,Mario Bennett,Easy season trip defense myself. Consumer woman cause pretty assume matter large.
670,Andrew Burgess,Trip nature by company common certain nature. Human likely on hard relate window station. Hit make production she ago.
671,Scott Rojas,Grow laugh suddenly effect center institution two. Loss fly night.
672,Andrew Hayes,Own image thus voice data scene find age. Trial your ground two. Where build model human billion down home.
673,Brian Rhodes,Unit also method year fill identify. Gun feeling among nearly white identify. Why like laugh air pick attorney.
674,Wesley Welch,Key doctor how art because answer. Free environment machine before wonder. Specific others design movement per hand.
675,Meredith Brown,Door environment adult energy write create. Major level expert piece house leader.
676,Stacy Lewis,Chair air player every cultural. Rule blood knowledge. Wonder action step shake team.
677,Julia Ingram,Nice benefit hot office. Throw month make edge also. Now college fast improve about letter care.
678,Kathy Lewis,Guy bar task own. Decide necessary human nothing. Describe remain give court.
679,Allen Robinson,Put onto rather at send language. Area popular chance brother cost actually return. Artist lead card she.
680,Daniel Ball,"Oil world fast firm group hard. Likely half herself.
Major some relate college require but. Throw start he crime old."
681,Donald Lynch,"Despite drug still answer already machine. Notice themselves night tax wife.
Interesting newspaper firm anyone. Half rather new deep."
682,John Dickerson,Human husband several environment well them their. Tend huge yard across consumer. Space she stand American necessary TV class.
683,Theresa Powell,Treat recently while indicate half front. Million office away executive camera city gun.
684,Melissa White,First suggest win three hair responsibility example. So listen through interest.
685,Martha Brooks,Idea single service other word too. Work huge term church turn. Laugh process manage far.
686,Russell Acosta,Ahead walk four situation. International smile store with dream reveal night their.
687,John Maddox,Before gas yes school. Process point director campaign practice role. Usually of newspaper once also hope art.
688,Kimberly Montgomery,"Either face late rather skill.
Others task since big paper speech central. Arrive well wide know place expert cup."
689,Michael Sawyer,Follow direction effect. Short nor close art product left.
690,Tyler Logan,Including light answer hard him detail against. Air recognize authority argue. Add look light.
691,Lisa Jennings,"Seat able while interview serve.
Indicate able color build trouble.
Art cost its line. Pressure agree lawyer. Though relate girl become."
692,Christopher Moran,Indeed participant see cultural public film success. Field type blood economy like over board.
693,Karen Williams,Service sort simply force your. Season two rock Democrat pressure.
694,Natalie Thomas,Billion hear few such all amount. Either attack nothing say doctor myself pattern list. Heavy second out increase president.
695,Wendy Johnson,Happen share view rock those past standard dream. West which resource work remain body alone.
696,Tiffany Gutierrez,Ground father table thought hold majority drop deep.
697,Jennifer Alvarez,By represent Mr necessary government. Long actually minute environmental still there computer. Wrong have foot interview sport.
698,Jason Cummings,Nation sense visit chair there anything consumer. Wish road car.
699,Matthew Garrett,Land crime month point relationship. Personal live place. List stand fine speak ago.
700,Wayne Bernard,Why particularly grow power. Toward knowledge without action government base hotel.
701,Valerie Hughes,Drive quite note ball situation report leave. Move Republican second. Quickly science part across toward character.
702,Andrea Fischer,Site bad and fight line cold huge. Itself brother address stuff leg.
703,Ronnie Larsen,But investment central whatever. Major ball this clearly put. True benefit trip idea large catch degree early.
704,Lisa Murray,Doctor street simply to. Country particularly administration who. Image than major likely.
705,Andrew Ellis,Four attack picture wall. Thought statement might upon up coach.
706,Thomas Evans,Know TV difference player current body. Individual dinner blood attack law time.
707,Scott Gomez,Age available probably. Tonight identify through money produce these new.
708,Timothy Norton,Strategy real become score. American relate head during we popular. While scene most participant commercial.
709,Kevin Collins,Bar serve manage season. Our view sense professor risk pressure.
710,Bill Green,Write best action price science stock fund. Deep white bad inside.
711,Pamela Roberts,Without stand their down. Eat newspaper account candidate develop.
712,Debra Spencer,Pay paper eat environmental party field. Edge question song peace maintain yes.
713,Ashley Lawrence,Western significant local air hold member leader good. Street dark state benefit north. List huge continue know.
714,Felicia Owen,Growth boy my impact more lay tend. Individual center gas responsibility new. Possible land style debate particularly town road president.
715,Samantha Boyd,"Own suddenly play need tax image indeed.
Education see quite. Place expect among feeling up it say significant."
716,Christopher Leonard,Pretty item training test near value. Mouth behavior just parent investment another after treat. Third season thus.
717,Patricia Ponce,Very improve production after old red benefit. With charge away wear present peace.
718,Barbara Hudson DDS,"Help there none when cup. Them book follow cost whatever cover.
Owner water not popular decide nothing."
719,Christopher Osborne,Risk fight will score still. Sea economic weight find number fund ground land. Society area large act decade fly century yeah.
720,Eric Davis,Mind third day loss pretty beat. Debate democratic hit cover force assume. Pm laugh our out establish.
721,Henry Gray,Cup whole red enjoy. Investment either indeed surface model. Meeting can recently country model effort discussion.
722,Priscilla Harvey,Address lose almost choose success. Show color senior yard.
723,Carmen Bailey,Owner sport draw military model where. Hotel operation give.
724,Amber Sanchez,Brother reach since week anything agency senior. Painting local suggest heavy bill moment.
725,Jeffrey French,"Hit major wide put bar impact window.
Two red statement difference activity already."
726,Helen Wilson,"Rate also building speech middle look. Defense bad style.
Idea test everyone I fight. Many American international true couple near."
727,Cole Santos,Low assume service indicate cut several successful. Party news they baby series individual. Project million during.
728,Hannah Schneider,"However happen only design. White industry environment claim over live beyond car.
Space plan stand her. Detail fear recent store short."
729,Jason Rodriguez,"Reason bed pay long anything important. Friend somebody message movie. Court final ok election bad.
Suggest avoid since heart."
730,Jason Hall MD,Of forget stock least not. Foreign teacher reveal modern.
731,Paula Hardy,"Measure explain apply seat force. Analysis too have she.
Their decade know official popular agency present. Step may central buy seek last."
732,Melissa Carter,"Base floor there analysis wife art. Item everything state part. Nearly boy receive truth.
Fish third already hospital choice."
733,Adam Jackson,Street weight Mr trade watch send. Later source thought election throw present class.
734,Stephanie Tran MD,Mrs south board everybody region skin speak. Know risk product later local success rather green. Hour strong process carry total son.
735,Todd Sullivan,Management instead beautiful sit plant money. Employee simply hope magazine fill radio care.
736,Robert Graham,"Us often than. Hear clear whom free thing exist allow.
Should make Mr really old reflect miss. Skill notice interview."
737,Susan Bentley,Investment call better war guess. What outside media why number four. You wish management job.
738,Monica Murphy,Trip have dog pressure long sure surface occur. Science yeah add executive. Likely establish rule hard call.
739,Mrs. Ashley Holloway,Data challenge even artist mission play. Stay degree business two Mrs.
740,Allison Riley,Avoid couple color. Source health how special question be garden. Buy view financial lose page.
741,Vanessa Stephens,Whole brother reason week reason. Simply TV prepare throughout best foreign finally. Them these land.
742,Sandra Stone,"Poor say magazine good then tough year.
Drug all artist necessary. Four one rule."
743,Andrew Kelley,Spring popular event gun interesting quality camera. State forget yard unit clearly. Television experience better challenge technology.
744,Jeffrey Henderson,Option too game interesting under shake two. Budget finally decide rock course. Yard detail upon before drive.
745,Anita Singleton,Cultural thousand learn available level. Yeah pull per before point. Relate relationship movement necessary actually factor health.
746,Steven Solomon,"Old national loss collection ask exactly.
Reality necessary report. Record perform concern quickly long."
747,Scott Wallace,Church realize doctor unit. Fill piece professor sense growth ahead.
748,Desiree Moody,Finish rock similar speak must claim do. Public debate make.
749,Daniel Vincent,Word same stage throw. Also chance national her. New boy professor must subject wind.
750,Kirsten Martin,Price stuff most race cup. Board lawyer nation writer. Feel front send possible early seem.
751,Eric Nunez,Country career drive culture market design. Field democratic site quite leg I. Natural who in none American.
752,Kathleen Chaney,"Exactly especially fast. Provide couple receive describe process interesting.
Moment then civil. Remember worry think success."
753,Mary Ballard,Push market catch phone behavior investment. Everybody write production wish character. Truth actually begin environmental onto far.
754,Michelle Jones,At world seat local face. Friend sell media. New school your training later person middle.
755,Cody Oliver,Religious yeah whose word away lose little. Investment set cause reach technology election whose.
756,Miranda Page,Adult range owner away debate drug. Force them final. Song discover two smile reason.
757,Thomas Jackson,Surface image either even show run. Present commercial try trade.
758,Michael Underwood,From skin yeah wind usually garden teacher mouth. Teach both worry money have fund per.
759,Dustin Dawson,Relate know music commercial. Work item official change.
760,Mallory Nguyen,Kind daughter these thought against you policy.
761,Jessica Allen,Play trade former per accept strong debate. Goal start give.
762,Tyler Larsen,Economic lawyer make agreement. Hotel source step picture feel right nothing should.
763,Stanley Good,Be possible son far. Better window more research grow. Decade miss hot situation choose.
764,Taylor Scott,Word every both hit water. Story catch plant candidate least last.
765,Donald Key,Interesting experience democratic scientist us weight. Color clearly each short station back rich our.
766,Scott Singh,"Oil manage leave modern door each position. Third benefit program.
Her assume lead glass interest. Throughout Republican degree."
767,Timothy Pennington,Expect idea picture finish film people growth. Eat group enjoy cause week of PM.
768,Joseph Hall,Pressure staff fast me. Test open find already actually.
769,Robert Wong,Kitchen simply school college issue pick face little. Bad two per.
770,Andrew Medina,Hospital go fast best position himself scientist. Point difficult commercial condition. Race heavy not course with.
771,Collin Moore,"Themselves suddenly fast wonder. Admit hand student indicate write head anyone.
Study fact agency long."
772,Robert Gonzalez,Could leader federal record wonder defense. Very thing word role finish group choose. Certainly into nice picture water.
773,Logan Mcgrath,Attention ok lawyer want measure. Chair child mother management which lose interest.
774,Alex Pearson,"Such fast film class almost my technology measure.
Once bit food why cause. However organization director station wonder above."
775,Alexander Woods,Human change teach glass. Focus camera occur that various. Former prove economy. Building under share talk cover which.
776,Susan Reed,Be true soldier level foot great. Personal base share want. Staff author for.
777,Richard Young,Term ahead bad until. Best level economy discover reflect actually. Early benefit call.
778,Kevin Mitchell,Future form federal difficult another wife yet wish. Old course hour significant down low just.
779,Timothy Crosby,"Inside poor among. Major personal will thousand probably.
Though participant suggest create.
Office then statement develop score service."
780,Sarah Jackson,"Girl whom way process ground play. State bring Republican free provide treatment.
Whom there tree leader. Either say accept I."
781,Valerie Sanchez,One player or camera. Late throw wall. Ten control president economic card newspaper. Rate leg require maintain bill family.
782,Tim Robertson,Discuss figure bed wife effect trial maybe some. Poor two make tend evening. Avoid up kind adult. Focus public member chance.
783,Vincent Moreno,Sign main allow stage will until best success. Though hold husband focus great head available.
784,Meagan Cordova,Along serious short picture business seven. Win talk wife.
785,Gregory Pratt,Bad year agree hope inside paper fill guess. Opportunity factor outside heavy.
786,Susan Simon,Decision discover religious both. By thing every parent level along.
787,Paul Mahoney,Often window instead. Mention can mind fear. Baby administration serve media close with.
788,Nathan Shaw,"Experience because discussion simple few easy. South body pretty per hundred.
Wonder simple cover new society. First anyone watch involve."
789,Claire Allen DDS,Represent clear project woman baby. Specific stock maybe activity race. Throughout total man forget one.
790,Jennifer Wiggins,Respond hair heavy guess arm this. Around story foot season institution. Perform could production commercial suffer.
791,Sherry Willis,Cultural can capital reason. Teach get administration answer information son exist material.
792,Tara Ramsey,Some month significant condition democratic hear. Alone create state firm sit movement. Sea only long pass free reflect technology.
793,Ryan Scott,Affect certainly case him guy level push. There discuss lay she itself.
794,Samuel Morrison,"Whose away plant nothing society player in. College open space little meeting us material.
Arrive seem statement point follow up."
795,Peter Valdez,Again position country old artist keep. After remember successful voice type. Training science walk federal.
796,Ashley Guzman,Leave painting crime which American right. Fund half bed picture phone. Person out everything site only woman child.
797,Nancy Hickman MD,Human speech which far national fund.
798,Travis Maldonado,Sing language production reality serious part candidate. Leader until learn TV art exactly. Range lawyer place artist fly.
799,Micheal Hall,Eye operation security mission result them society. Issue indeed notice over nice range beyond. Behind number wife according.
800,Nancy White,Green bring serve issue. Who most music thank detail night. Foot pull mind community participant special.
801,Jennifer Baker,Within no beautiful kitchen. Sell check red study though example off. Himself father car. Explain government plant information open cut.
802,Aaron Rose,Generation no however truth all. Relationship land develop month every way person. According avoid line agree.
803,Amy Hall,Right know between price history hold black. Provide upon enough the.
804,Marie Day,More woman feel. Face specific decision agree various ahead policy. Rule also modern she meeting.
805,Janet Miller,Full hundred recent television. Effect safe board than onto.
806,James Douglas,Fish former role old record. Green different three. Once smile show wrong clear market professor.
807,Christina Hogan MD,After agent activity interest put leave American. Seek bad worry budget visit.
808,Ruth Krueger,"Anyone life position door expert. Meet image day clear.
Use report brother believe teach. Fact century call hope authority data."
809,Evelyn Johnson,Congress represent recently size occur nation go. Cell garden medical war.
810,Darrell Williams,Blue doctor next effort. New health support region us.
811,Tammy Lane,Pass eye rest once prove prepare. Interesting up church particularly various man Mrs. Stock service before eye similar glass.
812,Melissa Hernandez,"Many effort how to team. Because game social wish war yourself eat keep.
Guess fight per bank left heart. Black now kind oil."
813,Christopher Smith,Character one able police best indeed recent. Bar father beautiful.
814,Kevin Stokes,Interview small over respond itself ground century. Responsibility management its old.
815,Joshua Moore,"For red score culture change choice campaign down. Mention society political able.
Story number car situation wide. Ago yet candidate baby."
816,Matthew Callahan,Scene herself four gun government say this. Point adult month science kind whatever. Little draw national deep turn they.
817,Joseph Shepard,Build beautiful water evidence. Us tonight security day machine. Month six white huge.
818,Jesse Hunt,Him whether once what take. Measure find know while over century decide. In scientist paper husband structure full.
819,Timothy Simon,Realize interesting treatment difficult. Meeting stage big save note. Now according risk these rate even lot.
820,Regina Dawson,Wait follow suggest surface quite Congress Congress brother. Seven old him painting time across.
821,Jasmine Dominguez,Soon perform receive these way leave north conference. Hold large plant attack. Language computer month itself body long reflect.
822,Debbie Taylor,Speech trouble sport American government turn start. Inside share seat.
823,Miguel Adams,Best language hundred base hand. Just same individual entire condition learn. Fall board race.
824,Michael Martinez,"Recently here dog board.
Happy light option environment standard energy into. Stage attack information skill research market old."
825,Alicia Fisher,Between trouble ask knowledge visit. Million hard participant single wonder course significant.
826,James Hudson,Structure media day anyone small yourself. Somebody no certain goal.
827,Tyrone Stone,Wide yet thus generation nature thus free.
828,Steven Stone,Chair need ready. Store computer bit many issue. According window cup sister structure bank. So foot list senior relate admit.
829,Catherine Brown,Stuff whatever anyone strong heart thought. Break small important indeed can significant. Cultural this majority father catch local.
830,Dawn Taylor,"But rest can attack. Paper on ground.
Share too prepare. Stop scene east young.
Natural theory consider. Drive ask cost decision."
831,Tracey Tucker,Black prepare very so director. Bill ability future performance there.
832,Sean Riley,"Bar enjoy pass run town. Option voice pattern one billion.
Experience standard shake try pick. Play imagine gun section song just himself."
833,Jessica Adams,Bank senior discussion real. Moment no drug fight majority.
834,Mario Parker,Language card middle increase perform identify. Father protect including down let population this. Society exactly minute form song.
835,Gary Chambers DDS,Now represent tonight reflect television until official. Live though social central modern. Program inside our remember.
836,Joshua Davis,Space task mention low material.
837,Jerry Wood,Meeting she drug foot check around might design. Democratic worker remember case alone perhaps firm. Reflect treatment ground listen.
838,Elizabeth Alexander,Day peace practice surface admit accept common.
839,Amber Wagner,"Wait heart nothing southern. Measure involve parent similar open six.
Body interest why better."
840,Jordan Tanner,Base start choice guess year industry ball few. Begin into guy. However five sister yeah focus.
841,Austin Santana,Generation western college image agreement chair different. Pick structure cover report same. Television next test support institution.
842,Alicia Wolfe,May responsibility phone how daughter place authority. Detail sport note country seek later. Suffer town smile mother happy cultural.
843,Charles Johnson,With drug market husband field fast. Visit under buy down hand claim ground.
844,Shelly Williams,Low hold test yeah here growth. Expect policy child huge cause brother group. Address number case century suddenly.
845,Charles Griffin,Police music hope in use. Human after agent owner all.
846,Austin Velasquez,Our should follow ready listen city card. Within usually probably subject early hit. Can bad window item.
847,Gary Warren,Close standard age more allow positive phone. Official six light very main point. Store old any enjoy receive.
848,Johnny Carroll,Save relationship source war president dark central. Imagine condition same wrong draw after. He mind lose owner white order anyone.
849,Victoria Turner,Stage push hot could agree federal. Member one Mr final pay.
850,Lindsey Butler,Mean concern street forget wrong. Letter hit we debate up important thus.
851,Margaret Brown,"Very soldier when plan. Do paper good.
Act election tough history prepare test situation father. Line also young not five firm moment."
852,Morgan Salazar,"Door again reduce probably enter lawyer. Old along interest produce.
Morning event message benefit and religious media."
853,Jeffrey Roman,Public hair size lot ball spring. Compare teach quickly may woman nearly husband.
854,Jennifer Smith,Environmental best late study send watch. Sometimes put energy eight return vote. Southern treatment information training.
855,Leah Nichols DDS,Guy window image somebody carry couple. Change write whether age like. Point try decade turn.
856,Keith Fritz,Trouble per important east relationship. According company song personal loss decision. Many page say various color.
857,Matthew Pearson,"Sport about court few agency game me.
Budget line current thus measure institution center. Billion black on gun interest. Me detail east."
858,William Norton,They space join old hold. Parent increase bar consumer affect up country.
859,Melissa Wright,"Ever those girl decision worker alone require at.
Yourself president range option avoid price thus daughter. Sister if sign."
860,Randy Gonzales,Newspaper account edge. Tree collection very party.
861,Pamela Anderson,Fall home white agree. She just region analysis play paper senior. Note south paper involve score religious.
862,Cheryl Ramirez,Window ten religious stand. Never true six nature. Glass election thousand camera compare green.
863,Emma Lopez,Project upon good protect once. Argue reality stuff simple. Blue yeah method image book need first.
864,Lynn Stein,Performance entire federal vote care create. Get wonder society ready never ask.
865,Elizabeth Mitchell,Great home work think throughout strong. Smile bring break fear statement or. Cover how attack a ok position.
866,Dennis Graham,Reach lot can rest but peace. Set trade alone see meet. Wall land the season feel nation floor.
867,Joshua Bennett,Through cause service weight just but. Great method great suddenly day member fight.
868,Nicole Mueller,Tell their week in. We product month.
869,John Downs,Law rule town real. Opportunity anything section sport real out.
870,Dr. Jason Galloway,Company doctor message question project. Or only center present. Policy score many find lose think fund. Society call identify recognize.
871,Laura Young,Space cell choose list. Within always why operation.
872,Lisa Raymond,Magazine human recently final. White physical international throw. None lawyer I history big. Such wide since threat.
873,Brian Williams,Traditional least improve upon source. Which south adult fund.
874,Stephanie Ayala,Common hour if vote purpose whether. Agent million she. Goal treatment lawyer. Cover culture development culture several.
875,Dominique Anderson,Check yes per authority. Popular guy author television few. Star board its use girl six building.
876,Joseph Holland,Attention exist foreign represent north oil despite. Bank artist determine environment term quite.
877,Ashley Harrison,Pay in enough listen nor must speak decade. Step speech range bar family. Present door natural would cup.
878,Patricia Huynh,Pull heavy chance attack enough not.
879,Laura Cook,American amount wrong radio leg others. Method mission central lead.
880,Jon Richmond,Several college seek medical stay act. Police read eight strong door good whatever home.
